{
  "$schema": "https://json-schema.org/draft/2020-12/schema",
  "title": "CodeFixer verification",
  "type": "object",
  "additionalProperties": true,
  "required": ["schema_version", "candidate_sha256", "passed", "steps"],
  "properties": {
    "schema_version": {"const": 1},
    "candidate_sha256": {"type": "string", "minLength": 1},
    "passed": {"type": "boolean"},
    "steps": {"type": "array", "items": {"type": "object"}}
  }
}
